[
  {"case_id":"kb-lay-collection","query":"회원가입 때 개인정보 받기는 어떤 법률용어로 관리하나요?","category":"lay_to_legal","difficulty":"easy","expected_concept_ids":["pipa_collection_use"],"expected_law_id":"011357","expected_article_refs":["제15조"],"expected_abstain":false,"reference_date":"2026-08-04","annotation_note":"일상어 '개인정보 받기'를 수집·이용 개념에 연결한다."},
  {"case_id":"kb-lay-minimum","query":"서비스에 필요하지 않은 정보까지 받는 정보 과다 수집은 무엇을 확인하나요?","category":"lay_to_legal","difficulty":"medium","expected_concept_ids":[],"expected_law_id":null,"expected_article_refs":[],"expected_abstain":true,"reference_date":"2026-08-04","annotation_note":"등록되지 않은 표현을 억지로 최소 수집 개념에 매핑하지 않는다."},
  {"case_id":"kb-lay-third-party","query":"고객정보를 다른 회사에 정보 넘기기 하는 경우의 법률용어는?","category":"lay_to_legal","difficulty":"easy","expected_concept_ids":["pipa_third_party_provision"],"expected_law_id":"011357","expected_article_refs":["제17조"],"expected_abstain":false,"reference_date":"2026-08-04","annotation_note":"제3자 제공과 처리위탁을 구별한다."},
  {"case_id":"kb-lay-purpose-outside","query":"고객정보를 처음 말한 목적과 다르게 쓰기 하면 무엇에 해당하나요?","category":"lay_to_legal","difficulty":"easy","expected_concept_ids":["pipa_purpose_outside"],"expected_law_id":"011357","expected_article_refs":["제18조"],"expected_abstain":false,"reference_date":"2026-08-04","annotation_note":"목적 외 이용·제공 제한에 연결한다."},
  {"case_id":"kb-lay-destruction","query":"보유기간이 지난 정보 폐기는 어떤 개념인가요?","category":"lay_to_legal","difficulty":"easy","expected_concept_ids":["pipa_destruction"],"expected_law_id":"011357","expected_article_refs":["제21조"],"expected_abstain":false,"reference_date":"2026-08-04","annotation_note":"일상어 폐기를 개인정보 파기에 연결한다."},
  {"case_id":"kb-lay-resident-number","query":"회원가입 때 주민번호 수집은 어떤 제한을 받나요?","category":"lay_to_legal","difficulty":"easy","expected_concept_ids":["pipa_resident_number"],"expected_law_id":"011357","expected_article_refs":["제24조의2"],"expected_abstain":false,"reference_date":"2026-08-04","annotation_note":"주민등록번호 처리 제한에 연결한다."},
  {"case_id":"kb-distinguish-outsourcing","query":"외주업체에 고객정보 맡기기는 제3자 제공이 아니라 어떤 개념인가요?","category":"similar_concept","difficulty":"hard","expected_concept_ids":["pipa_processing_delegation"],"expected_law_id":"011357","expected_article_refs":["제26조"],"expected_abstain":false,"reference_date":"2026-08-04","annotation_note":"질문에 제3자 제공도 등장하지만 더 긴 위탁 일상어를 우선한다."},
  {"case_id":"kb-lay-policy","query":"회사가 공개하는 개인정보 정책의 법률용어와 근거 조문은?","category":"lay_to_legal","difficulty":"easy","expected_concept_ids":["pipa_privacy_policy"],"expected_law_id":"011357","expected_article_refs":["제30조"],"expected_abstain":false,"reference_date":"2026-08-04","annotation_note":"개인정보 정책을 처리방침에 연결한다."},
  {"case_id":"kb-legal-breach-notice","query":"개인정보 유출 등의 통지·신고의 근거 조문은?","category":"legal_to_article","difficulty":"easy","expected_concept_ids":["pipa_breach_notice"],"expected_law_id":"011357","expected_article_refs":["제34조"],"expected_abstain":false,"reference_date":"2026-08-04","annotation_note":"법률용어에서 법률 조문으로 연결한다."},
  {"case_id":"kb-lay-stop-processing","query":"내 정보 사용 중단을 요구하는 법률상 개념은?","category":"lay_to_legal","difficulty":"easy","expected_concept_ids":["pipa_stop_processing"],"expected_law_id":"011357","expected_article_refs":["제37조"],"expected_abstain":false,"reference_date":"2026-08-04","annotation_note":"처리정지와 파기를 구별한다."},
  {"case_id":"kb-lay-biometrics","query":"개인 식별에 쓰는 지문 정보는 어떤 민감정보 개념과 연결되나요?","category":"lay_to_legal","difficulty":"medium","expected_concept_ids":["pipa_sensitive_biometrics"],"expected_law_id":"011468","expected_article_refs":["제18조"],"expected_abstain":false,"reference_date":"2026-08-04","annotation_note":"시행령상 생체인식정보 범위에 연결한다."},
  {"case_id":"kb-lay-72h","query":"유출 72시간 신고의 법률용어와 근거 조문은?","category":"legal_to_article","difficulty":"medium","expected_concept_ids":["pipa_breach_report_deadline"],"expected_law_id":"011468","expected_article_refs":["제40조"],"expected_abstain":false,"reference_date":"2026-08-04","annotation_note":"법률상 통지·신고와 시행령상 신고기한을 구별한다."},
  {"case_id":"kb-lay-access-media","query":"통장 빌려주기는 전자금융거래법상 어떤 개념인가요?","category":"lay_to_legal","difficulty":"easy","expected_concept_ids":["eft_access_media"],"expected_law_id":"010199","expected_article_refs":["제6조"],"expected_abstain":false,"reference_date":"2026-08-04","annotation_note":"접근매체 관리 개념에 연결한다."},
  {"case_id":"kb-lay-electronic-accident","query":"전자금융사고 보상과 관련한 금융회사 책임의 근거는?","category":"legal_to_article","difficulty":"medium","expected_concept_ids":["eft_provider_liability"],"expected_law_id":"010199","expected_article_refs":["제9조"],"expected_abstain":false,"reference_date":"2026-08-04","annotation_note":"전자금융업자 책임에 연결한다."},
  {"case_id":"kb-lay-record-retention","query":"계좌거래 기록 보존기간은 어떤 법률용어와 조문에 연결되나요?","category":"legal_to_article","difficulty":"easy","expected_concept_ids":["eft_record_retention"],"expected_law_id":"010199","expected_article_refs":["제22조"],"expected_abstain":false,"reference_date":"2026-08-04","annotation_note":"전자금융거래기록 보존·파기 개념에 연결한다."},
  {"case_id":"kb-lay-worker","query":"알바생이 근로기준법상 어떤 개념에 해당하는지 확인해줘.","category":"lay_to_legal","difficulty":"easy","expected_concept_ids":["labor_worker"],"expected_law_id":"001872","expected_article_refs":["제2조"],"expected_abstain":false,"reference_date":"2026-08-04","annotation_note":"계약 명칭과 무관하게 근로자 개념 후보로 연결한다."},
  {"case_id":"kb-lay-written-terms","query":"급여와 근무시간 서면 안내는 어떤 의무인가요?","category":"lay_to_legal","difficulty":"easy","expected_concept_ids":["labor_written_terms"],"expected_law_id":"001872","expected_article_refs":["제17조"],"expected_abstain":false,"reference_date":"2026-08-04","annotation_note":"근로조건 명시 개념에 연결한다."},
  {"case_id":"kb-distinguish-dismissal-notice","query":"30일 전 해고통보는 해고사유 서면통지가 아니라 어떤 제도인가요?","category":"similar_concept","difficulty":"hard","expected_concept_ids":["labor_dismissal_notice"],"expected_law_id":"001872","expected_article_refs":["제26조"],"expected_abstain":false,"reference_date":"2026-08-04","annotation_note":"해고예고와 서면통지를 구별한다."},
  {"case_id":"kb-lay-dismissal-writing","query":"해고 사유와 날짜 적어주기는 어떤 의무인가요?","category":"lay_to_legal","difficulty":"medium","expected_concept_ids":["labor_dismissal_writing"],"expected_law_id":"001872","expected_article_refs":["제27조"],"expected_abstain":false,"reference_date":"2026-08-04","annotation_note":"해고사유 등의 서면통지에 연결한다."},
  {"case_id":"kb-lay-waiting-time","query":"회사에서 지시 기다리는 시간도 어떤 근로시간 개념으로 검토하나요?","category":"lay_to_legal","difficulty":"medium","expected_concept_ids":["labor_waiting_time"],"expected_law_id":"001872","expected_article_refs":["제50조"],"expected_abstain":false,"reference_date":"2026-08-04","annotation_note":"대기시간과 휴게시간을 구별한다."},
  {"case_id":"kb-lay-break","query":"4시간 일할 때 휴식은 어떤 조문의 휴게인가요?","category":"legal_to_article","difficulty":"easy","expected_concept_ids":["labor_break"],"expected_law_id":"001872","expected_article_refs":["제54조"],"expected_abstain":false,"reference_date":"2026-08-04","annotation_note":"휴게시간 조문에 연결한다."},
  {"case_id":"kb-lay-unfair-contract","query":"궁박함을 이용한 계약은 민법상 어떤 법률행위인가요?","category":"lay_to_legal","difficulty":"medium","expected_concept_ids":["civil_unfair_juristic_act"],"expected_law_id":"001706","expected_article_refs":["제104조"],"expected_abstain":false,"reference_date":"2026-08-04","annotation_note":"불공정한 법률행위에 연결한다."},
  {"case_id":"kb-lay-mistake","query":"계약의 중요한 부분을 착각한 경우 어떤 의사표시인가요?","category":"lay_to_legal","difficulty":"medium","expected_concept_ids":["civil_mistake"],"expected_law_id":"001706","expected_article_refs":["제109조"],"expected_abstain":false,"reference_date":"2026-08-04","annotation_note":"착오로 인한 의사표시에 연결한다."},
  {"case_id":"kb-lay-fraud","query":"속아서 계약한 경우의 법률용어와 조문은?","category":"legal_to_article","difficulty":"easy","expected_concept_ids":["civil_fraud_duress"],"expected_law_id":"001706","expected_article_refs":["제110조"],"expected_abstain":false,"reference_date":"2026-08-04","annotation_note":"사기·강박에 의한 의사표시에 연결한다."},
  {"case_id":"kb-distinguish-contract-damages","query":"계약 위반 배상은 불법행위가 아니라 어떤 책임인가요?","category":"similar_concept","difficulty":"hard","expected_concept_ids":["civil_nonperformance_damages"],"expected_law_id":"001706","expected_article_refs":["제390조"],"expected_abstain":false,"reference_date":"2026-08-04","annotation_note":"채무불이행과 불법행위를 구별한다."},
  {"case_id":"kb-lay-simultaneous","query":"상대방이 안 하면 나도 거절할 수 있다는 법률용어는?","category":"lay_to_legal","difficulty":"medium","expected_concept_ids":["civil_simultaneous_performance"],"expected_law_id":"001706","expected_article_refs":["제536조"],"expected_abstain":false,"reference_date":"2026-08-04","annotation_note":"동시이행의 항변권에 연결한다."},
  {"case_id":"kb-legal-tort","query":"불법행위의 민법상 근거 조문은?","category":"legal_to_article","difficulty":"easy","expected_concept_ids":["civil_tort"],"expected_law_id":"001706","expected_article_refs":["제750조"],"expected_abstain":false,"reference_date":"2026-08-04","annotation_note":"법률용어를 직접 조문에 연결한다."},
  {"case_id":"kb-ambiguous-damages","query":"손해배상을 받을 수 있나요?","category":"ambiguous","difficulty":"hard","expected_concept_ids":[],"expected_law_id":null,"expected_article_refs":[],"expected_abstain":true,"reference_date":"2026-08-04","annotation_note":"책임 원인과 적용 법률이 없어 유보한다."},
  {"case_id":"kb-outside-tax","query":"종합소득세 신고기한은 언제인가요?","category":"out_of_scope","difficulty":"easy","expected_concept_ids":[],"expected_law_id":null,"expected_article_refs":[],"expected_abstain":true,"reference_date":"2026-08-04","annotation_note":"현재 지식베이스 범위 밖 조세 질문이다."},
  {"case_id":"kb-temporal-before-corpus","query":"2025년 9월 1일 개인정보의 수집·이용 근거를 이 지식베이스로 확정해줘.","category":"temporal","difficulty":"hard","expected_concept_ids":[],"expected_law_id":null,"expected_article_refs":[],"expected_abstain":true,"reference_date":"2025-09-01","annotation_note":"보유한 개인정보 보호법 버전의 시행일 이전이므로 유보한다."},